{
  "schema_version": "1.0",
  "corpus_id": "local-boundaries-v1",
  "methodology_version": "1.0",
  "cases": [
    {"corpus":"local-boundaries-v1","id":"local-safe-subprocess-args","title":"Fixed executable and argument list with shell disabled","file":"false_positive/safe_subprocess_args.py","location":{"start_line":15,"end_line":23,"function":"dns_lookup"},"vulnerability_class":"safe-process-invocation","category":"in_scope_safe","metric_group":"code_vulnerability","in_scope":true,"expected_result":{"classification":"no_finding","rule_id":null,"severity":null,"unexpected_rules":["MCP001","MCP006"]},"source":"validated hostname parameter","sink":"subprocess.run argument list","attack_preconditions":[],"source_of_truth":{"kind":"fixture-contract","reference":"benchmark/fixtures/false_positive/safe_subprocess_args.py","note":"The executable is fixed, shell expansion is disabled, and the call has a timeout."},"rationale":"A model-controlled argument in a subprocess list is not shell command injection by itself.","review_status":{"state":"single-reviewed","reviewer":"fixture author","reviewed_at":"2026-08-20"},"matching":{"mode":"line_tolerant","line_tolerance":0}},
    {"corpus":"local-boundaries-v1","id":"local-safe-validated-path","title":"Resolved path is constrained to an allowed base","file":"false_positive/validated_paths.py","location":{"start_line":13,"end_line":17,"function":"read_report"},"vulnerability_class":"validated-file-path","category":"in_scope_safe","metric_group":"code_vulnerability","in_scope":true,"expected_result":{"classification":"no_finding","rule_id":null,"severity":null,"unexpected_rules":["MCP002"]},"source":"read_report name parameter","sink":"Path.read_text","attack_preconditions":[],"source_of_truth":{"kind":"fixture-contract","reference":"benchmark/fixtures/false_positive/validated_paths.py","note":"The candidate is resolved and rejected unless it is a descendant of the resolved base."},"rationale":"Canonical descendant validation prevents traversal.","review_status":{"state":"single-reviewed","reviewer":"fixture author","reviewed_at":"2026-08-20"},"matching":{"mode":"line_tolerant","line_tolerance":0}},
    {"corpus":"local-boundaries-v1","id":"local-safe-imported-auth","title":"Transport authorization is implemented in a sibling guard module","file":"false_positive/imported_auth/server.py","location":{"start_line":11,"end_line":19,"function":null},"vulnerability_class":"cross-file-transport-auth","category":"in_scope_safe","metric_group":"readiness","in_scope":true,"expected_result":{"classification":"no_finding","rule_id":null,"severity":null,"unexpected_rules":["RDY002"]},"source":"require_user decorator imported from guard","sink":"HTTP transport access policy","attack_preconditions":[],"source_of_truth":{"kind":"fixture-contract","reference":"benchmark/fixtures/false_positive/imported_auth/server.py and guard.py","note":"The fixture contract treats require_user as the transport-facing identity and policy gate."},"rationale":"A per-file name heuristic can miss a real guard when neither its module nor callable uses auth-shaped words.","review_status":{"state":"single-reviewed","reviewer":"fixture author","reviewed_at":"2026-08-20"},"matching":{"mode":"line_tolerant","line_tolerance":0}},
    {"corpus":"local-boundaries-v1","id":"local-safe-benign-imperative","title":"Imperative wording states a legitimate parameter constraint","file":"false_positive/benign_imperative_description.py","location":{"start_line":9,"end_line":10,"function":"exchange_rate"},"vulnerability_class":"benign-imperative-description","category":"in_scope_safe","metric_group":"description_vulnerability","in_scope":true,"expected_result":{"classification":"no_finding","rule_id":null,"severity":null,"unexpected_rules":["MCP101"]},"source":"tool docstring","sink":"model description context","attack_preconditions":[],"source_of_truth":{"kind":"fixture-contract","reference":"benchmark/fixtures/false_positive/benign_imperative_description.py","note":"The sentence constrains the parameter format and does not redirect or conceal model behavior."},"rationale":"Imperative grammar alone does not prove tool poisoning.","review_status":{"state":"single-reviewed","reviewer":"fixture author","reviewed_at":"2026-08-20"},"matching":{"mode":"line_tolerant","line_tolerance":0}},
    {"corpus":"local-boundaries-v1","id":"local-safe-legitimate-base64","title":"Base64 text is a documented fixture example","file":"false_positive/legitimate_base64_description.py","location":{"start_line":9,"end_line":10,"function":"decode_fixture"},"vulnerability_class":"legitimate-encoded-example","category":"in_scope_safe","metric_group":"description_vulnerability","in_scope":true,"expected_result":{"classification":"no_finding","rule_id":null,"severity":null,"unexpected_rules":["MCP103"]},"source":"tool docstring","sink":"model description context","attack_preconditions":[],"source_of_truth":{"kind":"fixture-contract","reference":"benchmark/fixtures/false_positive/legitimate_base64_description.py","note":"The encoded text is explicitly identified as test data and decodes to benign prose."},"rationale":"Long base64-like runs are heuristic signals, not proof of hidden instructions.","review_status":{"state":"single-reviewed","reviewer":"fixture author","reviewed_at":"2026-08-20"},"matching":{"mode":"line_tolerant","line_tolerance":0}},
    {"corpus":"local-boundaries-v1","id":"local-safe-json-loads","title":"JSON parsing is a safe deserialization alternative","file":"false_positive/safe_deserialization.py","location":{"start_line":12,"end_line":14,"function":"parse_payload"},"vulnerability_class":"safe-deserialization","category":"in_scope_safe","metric_group":"code_vulnerability","in_scope":true,"expected_result":{"classification":"no_finding","rule_id":null,"severity":null,"unexpected_rules":["MCP007"]},"source":"parse_payload payload parameter","sink":"json.loads","attack_preconditions":[],"source_of_truth":{"kind":"fixture-contract","reference":"benchmark/fixtures/false_positive/safe_deserialization.py:11-14","note":"JSON parsing does not construct arbitrary Python objects."},"rationale":"MCP007 should not flag json.loads.","review_status":{"state":"single-reviewed","reviewer":"fixture author","reviewed_at":"2026-08-20"},"matching":{"mode":"line_tolerant","line_tolerance":0}},
    {"corpus":"local-boundaries-v1","id":"local-safe-yaml-safe-load","title":"YAML uses the safe loader","file":"false_positive/safe_deserialization.py","location":{"start_line":18,"end_line":20,"function":"parse_yaml"},"vulnerability_class":"safe-deserialization","category":"in_scope_safe","metric_group":"code_vulnerability","in_scope":true,"expected_result":{"classification":"no_finding","rule_id":null,"severity":null,"unexpected_rules":["MCP007"]},"source":"parse_yaml payload parameter","sink":"yaml.safe_load","attack_preconditions":[],"source_of_truth":{"kind":"fixture-contract","reference":"benchmark/fixtures/false_positive/safe_deserialization.py:17-20","note":"The safe loader avoids arbitrary object constructors."},"rationale":"MCP007 should distinguish safe_load from yaml.load.","review_status":{"state":"single-reviewed","reviewer":"fixture author","reviewed_at":"2026-08-20"},"matching":{"mode":"line_tolerant","line_tolerance":0}},
    {"corpus":"local-boundaries-v1","id":"local-safe-duplicate-name-a","title":"Namespaced server A intentionally exposes status","file":"false_positive/intended_duplicate_names/server_a.py","location":{"start_line":8,"end_line":11,"function":"status"},"vulnerability_class":"intentional-tool-name-reuse","category":"in_scope_safe","metric_group":"code_vulnerability","in_scope":true,"expected_result":{"classification":"no_finding","rule_id":null,"severity":null,"unexpected_rules":[]},"source":"server A tool registration","sink":"client tool namespace","attack_preconditions":[],"source_of_truth":{"kind":"fixture-contract","reference":"benchmark/fixtures/false_positive/intended_duplicate_names/server_a.py","note":"The fixture assumes the client keeps explicit server namespaces."},"rationale":"A repeated generic tool name is not harmful when server identity remains part of resolution.","review_status":{"state":"single-reviewed","reviewer":"fixture author","reviewed_at":"2026-08-20"},"matching":{"mode":"line_tolerant","line_tolerance":0}},
    {"corpus":"local-boundaries-v1","id":"local-safe-duplicate-name-b","title":"Namespaced server B intentionally exposes status","file":"false_positive/intended_duplicate_names/server_b.py","location":{"start_line":8,"end_line":11,"function":"status"},"vulnerability_class":"intentional-tool-name-reuse","category":"in_scope_safe","metric_group":"code_vulnerability","in_scope":true,"expected_result":{"classification":"no_finding","rule_id":null,"severity":null,"unexpected_rules":[]},"source":"server B tool registration","sink":"client tool namespace","attack_preconditions":[],"source_of_truth":{"kind":"fixture-contract","reference":"benchmark/fixtures/false_positive/intended_duplicate_names/server_b.py","note":"The fixture assumes the client keeps explicit server namespaces."},"rationale":"Collision scanners need deployment context before treating reuse as a security finding.","review_status":{"state":"single-reviewed","reviewer":"fixture author","reviewed_at":"2026-08-20"},"matching":{"mode":"line_tolerant","line_tolerance":0}},